{
  "schema_version": "power-ringmin.finite_results_summary.v1",
  "artifact_type": "finite_results_summary",
  "problem": {
    "project": "power-ringmin",
    "radius_model": "quadratic",
    "dimension": 2,
    "constraints": {
      "central_external_tangency": true,
      "peripheral_pairwise_disjoint_interiors": true,
      "all_pairs_checked": true
    }
  },
  "summary_scope": {
    "n_values": [
      3,
      4,
      5,
      6
    ],
    "source_certificate_schema_version": "power-ringmin.small_n_interval_certificate.v1",
    "source_certificate_artifact_type": "small_n_interval_certificate",
    "source_evidence_scope": "finite_global_small_n_interval_bracket"
  },
  "source_certificate_count": 4,
  "definitions": {
    "candidate_set": "For one checked finite certificate, U is the verified global upper endpoint and C is the set of canonical orders sigma with verified strict lower endpoint L_sigma <= U.",
    "excluded_order": "An excluded order has verified strict lower endpoint L_sigma > U.",
    "exclusion_gap": "When excluded orders exist, the exclusion gap is min(L_sigma - U) over excluded orders; otherwise it is null.",
    "identical_serialized_brackets": "Groups of canonical orders whose source summary lower and upper endpoint strings are identical.",
    "ratio_reference": "n^3/(6*pi)."
  },
  "evidence_classification_by_category": {
    "certified_global_bracket": {
      "classification": "computer_certified_result",
      "basis": "verified source certificate global endpoints"
    },
    "candidate_set_membership": {
      "classification": "computer_certified_result",
      "basis": "verified source lower endpoints compared with verified global upper endpoint"
    },
    "excluded_order_count": {
      "classification": "computer_certified_result",
      "basis": "verified source lower endpoints compared with verified global upper endpoint"
    },
    "exclusion_gap": {
      "classification": "computer_certified_result",
      "basis": "verified source lower endpoints minus verified global upper endpoint"
    },
    "identical_serialized_bracket_groups": {
      "classification": "verified_fact",
      "basis": "string identity in semantically validated source certificate summaries"
    },
    "ratios_to_reference": {
      "classification": "numerical_observation",
      "basis": "finite-n arithmetic diagnostic against n^3/(6*pi)"
    },
    "cross_n_trends": {
      "classification": "empirical_pattern",
      "basis": "patterns visible only in the listed checked finite inputs"
    },
    "limitations": {
      "classification": "unresolved_claim",
      "basis": "explicit scope boundaries not settled by this artifact"
    }
  },
  "source_certificates": [
    {
      "path": "examples/small_n_interval_certificate_n3.json",
      "content_sha256": "7026b174251d92dcb84bd63bede4674b8248559ab6bb24449aecd161301d0043",
      "schema_version": "power-ringmin.small_n_interval_certificate.v1",
      "artifact_type": "small_n_interval_certificate",
      "n": 3,
      "evidence_classification": "computer_certified_result",
      "evidence_scope": "finite_global_small_n_interval_bracket",
      "source_provenance": {
        "repository_git_commit": "b2388e8d4015c1be67e731c77635bd2ea0fa0977",
        "repository_git_dirty": true
      }
    },
    {
      "path": "examples/small_n_interval_certificate_n4.json",
      "content_sha256": "d86bb1d6d76bf4a7d9ef01056130632537bd4b55533f67efa774e08fca3e22a5",
      "schema_version": "power-ringmin.small_n_interval_certificate.v1",
      "artifact_type": "small_n_interval_certificate",
      "n": 4,
      "evidence_classification": "computer_certified_result",
      "evidence_scope": "finite_global_small_n_interval_bracket",
      "source_provenance": {
        "repository_git_commit": "b2388e8d4015c1be67e731c77635bd2ea0fa0977",
        "repository_git_dirty": true
      }
    },
    {
      "path": "examples/small_n_interval_certificate_n5.json",
      "content_sha256": "d2233af9372ad3e409b9c065313bdb7d21ffa239fc0128e17de3d98317820258",
      "schema_version": "power-ringmin.small_n_interval_certificate.v1",
      "artifact_type": "small_n_interval_certificate",
      "n": 5,
      "evidence_classification": "computer_certified_result",
      "evidence_scope": "finite_global_small_n_interval_bracket",
      "source_provenance": {
        "repository_git_commit": "1b013793eafe03661d12e0c1ae5aec3e9173d151",
        "repository_git_dirty": false
      }
    },
    {
      "path": "examples/small_n_interval_certificate_n6.json",
      "content_sha256": "d0998e1ebe01467f9bcc1897ab59aec3e55ccd5c89053dca76404ab3f2e90c65",
      "schema_version": "power-ringmin.small_n_interval_certificate.v1",
      "artifact_type": "small_n_interval_certificate",
      "n": 6,
      "evidence_classification": "computer_certified_result",
      "evidence_scope": "finite_global_small_n_interval_bracket",
      "source_provenance": {
        "repository_git_commit": "32743f7f791c8a1550689e39f56347a194d4520a",
        "repository_git_dirty": false
      }
    }
  ],
  "results": [
    {
      "n": 3,
      "source_certificate": {
        "path": "examples/small_n_interval_certificate_n3.json",
        "content_sha256": "7026b174251d92dcb84bd63bede4674b8248559ab6bb24449aecd161301d0043",
        "schema_version": "power-ringmin.small_n_interval_certificate.v1",
        "artifact_type": "small_n_interval_certificate",
        "n": 3,
        "evidence_classification": "computer_certified_result",
        "evidence_scope": "finite_global_small_n_interval_bracket",
        "source_provenance": {
          "repository_git_commit": "b2388e8d4015c1be67e731c77635bd2ea0fa0977",
          "repository_git_dirty": true
        }
      },
      "canonical_order_count": 1,
      "certified_global_bracket": {
        "classification": "computer_certified_result",
        "lower_endpoint": {
          "radius_decimal": "0.3832870361393696523322205393924377858638763427734375",
          "encoding": "decimal_string",
          "included": false,
          "source_index_order": [
            3,
            1,
            2
          ]
        },
        "upper_endpoint": {
          "radius_decimal": "0.383487036139369685816546962087159045040607452392578125",
          "encoding": "decimal_string",
          "included": true,
          "source_index_order": [
            3,
            1,
            2
          ]
        },
        "width_decimal": "0.000200000000000033484326422694721259176731109619140625"
      },
      "candidate_set": {
        "classification": "computer_certified_result",
        "semantics": "canonical orders whose verified strict lower endpoint L_sigma is <= verified global upper endpoint U",
        "size": 1,
        "multiplicity_interpretation": "unique_certified_candidate_mod_rotation_reflection",
        "orders": [
          {
            "source_check_id": "LB-0001",
            "index_order": [
              3,
              1,
              2
            ],
            "radius_order": [
              9,
              1,
              4
            ],
            "lower_radius_decimal": "0.3832870361393696523322205393924377858638763427734375",
            "upper_radius_decimal": "0.383487036139369685816546962087159045040607452392578125"
          }
        ],
        "warning": "The unique candidate is modulo the current rotation/reflection convention."
      },
      "excluded_orders": {
        "classification": "computer_certified_result",
        "semantics": "canonical orders whose verified strict lower endpoint L_sigma is > verified global upper endpoint U",
        "count": 0,
        "orders": [],
        "exclusion_gap": {
          "classification": "computer_certified_result",
          "defined": false,
          "gap_decimal": null,
          "orders": []
        }
      },
      "identical_serialized_bracket_groups": {
        "classification": "verified_fact",
        "warning": "Identical serialized bracket endpoints are not an exact equality claim for fixed-order optima.",
        "groups": []
      },
      "exploratory_asymptotic_ratios": {
        "classification": "numerical_observation",
        "reference": "n^3/(6*pi)",
        "reference_value_decimal": "1.4323944878270580219199538703526292583101368116641",
        "midpoint_decimal": "0.3833870361393696690743837507397984154522418975830078125",
        "lower_ratio_decimal": "0.26758483043369984136076787098347228955705877327003",
        "midpoint_ratio_decimal": "0.26765464360377962623207969638536051054269711953714",
        "upper_ratio_decimal": "0.26772445677385941110339152178724873152833546580424",
        "warning": "These finite-n diagnostics are numerical observations only.",
        "additive_difference_from_reference": {
          "lower_minus_reference_decimal": "-1.0491074516876883695877333309601914724462604688907",
          "midpoint_minus_reference_decimal": "-1.0490074516876883528455701196128308428578949140811",
          "upper_minus_reference_decimal": "-1.0489074516876883361034069082654702132695293592715"
        }
      },
      "limitations": [
        "Finite checked certificate evidence for this n only.",
        "Candidate multiplicity is not an exact tie claim.",
        "Identical serialized brackets are not exact optimum equality claims."
      ]
    },
    {
      "n": 4,
      "source_certificate": {
        "path": "examples/small_n_interval_certificate_n4.json",
        "content_sha256": "d86bb1d6d76bf4a7d9ef01056130632537bd4b55533f67efa774e08fca3e22a5",
        "schema_version": "power-ringmin.small_n_interval_certificate.v1",
        "artifact_type": "small_n_interval_certificate",
        "n": 4,
        "evidence_classification": "computer_certified_result",
        "evidence_scope": "finite_global_small_n_interval_bracket",
        "source_provenance": {
          "repository_git_commit": "b2388e8d4015c1be67e731c77635bd2ea0fa0977",